{
  "last_run": "2026-02-24",
  "center": "Des Moines, IA",
  "radius_miles": 250,
  "artist_shows": {
    "Luke Combs": [
      {
        "date": "Apr 11, 2026",
        "venue": "Jack Trice Stadium",
        "city": "Ames, IA",
        "status": "on_sale",
        "distance_miles": 30.9,
        "lat": 42.0347,
        "lon": -93.62
      }
    ],
    "Morgan Wallen": [],
    "Zach Bryan": [
      {
        "date": "Apr 25, 2026",
        "venue": "Memorial Stadium",
        "city": "Lincoln, NE",
        "status": "on_sale",
        "distance_miles": 168.7,
        "lat": 40.8136,
        "lon": -96.7026
      }
    ],
    "Tyler Childers": [
      {
        "date": "Jul 14, 2026",
        "venue": "Morton Amphitheater",
        "city": "Kansas City, MO",
        "status": "on_sale",
        "distance_miles": 179.0,
        "lat": 39.0997,
        "lon": -94.5786
      },
      {
        "date": "Jul 15, 2026",
        "venue": "Casey's Center",
        "city": "Des Moines, IA",
        "status": "on_sale",
        "distance_miles": 0.0,
        "lat": 41.5868,
        "lon": -93.625
      }
    ],
    "Jason Isbell": [
      {
        "date": "Mar 4, 2026",
        "venue": "Hancher Auditorium",
        "city": "Iowa City, IA",
        "status": "on_sale",
        "distance_miles": 108.3,
        "lat": 41.6611,
        "lon": -91.5302
      },
      {
        "date": "May 3, 2026",
        "venue": "Uptown Theater",
        "city": "Kansas City, MO",
        "status": "on_sale",
        "distance_miles": 179.0,
        "lat": 39.0997,
        "lon": -94.5786
      }
    ],
    "CAAMP": [
      {
        "date": "Aug 24, 2026",
        "venue": "Starlight Theatre",
        "city": "Kansas City, MO",
        "status": "on_sale",
        "distance_miles": 179.0,
        "lat": 39.0997,
        "lon": -94.5786
      }
    ],
    "Chris Stapleton": [
      {
        "date": "Oct 7, 2026",
        "venue": "Pinnacle Bank Arena",
        "city": "Lincoln, NE",
        "status": "on_sale",
        "distance_miles": 168.7,
        "lat": 40.8136,
        "lon": -96.7026
      },
      {
        "date": "Oct 9, 2026",
        "venue": "Morton Amphitheater",
        "city": "Kansas City, MO",
        "status": "on_sale",
        "distance_miles": 179.0,
        "lat": 39.0997,
        "lon": -94.5786
      }
    ],
    "Dierks Bentley": [
      {
        "date": "Jun 13, 2026",
        "venue": "Morton Amphitheater",
        "city": "Kansas City, MO",
        "status": "on_sale",
        "distance_miles": 179.0,
        "lat": 39.0997,
        "lon": -94.5786
      },
      {
        "date": "Jun 20, 2026",
        "venue": "Denny Sanford PREMIER Center",
        "city": "Sioux Falls, SD",
        "status": "on_sale",
        "distance_miles": 208.1,
        "lat": 43.546,
        "lon": -96.7313
      }
    ],
    "Eric Church": [],
    "Lainey Wilson": [],
    "Colter Wall": [],
    "The Red Clay Strays": [],
    "Billy Strings": [],
    "Wyatt Flores": [
      {
        "date": "Mar 31, 2026",
        "venue": "The District",
        "city": "Sioux Falls, SD",
        "status": "on_sale",
        "distance_miles": 208.1,
        "lat": 43.546,
        "lon": -96.7313
      }
    ],
    "Dylan Gossett": [
      {
        "date": "Aug 2, 2026",
        "venue": "Morton Amphitheater",
        "city": "Kansas City, MO",
        "status": "on_sale",
        "distance_miles": 179.0,
        "lat": 39.0997,
        "lon": -94.5786
      }
    ],
    "Sturgill Simpson": [],
    "Johnny Blue Skies": [],
    "The Lumineers": [],
    "American Mary": [],
    "Bon Iver": [],
    "The War on Drugs": [],
    "Vampire Weekend": [],
    "Phoebe Bridgers": [],
    "Rostam": [],
    "Pearl Jam": [],
    "The Black Keys": [
      {
        "date": "Jul 20, 2026",
        "venue": "The Astro Amphitheater",
        "city": "La Vista, NE",
        "status": "on_sale",
        "distance_miles": 127.8,
        "lat": 41.1844,
        "lon": -96.0308
      }
    ],
    "Foo Fighters": [],
    "Jack White": [],
    "LCD Soundsystem": [],
    "The Strokes": [],
    "The 1975": [],
    "The Smile": [],
    "Noah Kahan": [],
    "Mt. Joy": [
      {
        "date": "Apr 21, 2026",
        "venue": "Starlight Theatre",
        "city": "Kansas City, MO",
        "status": "on_sale",
        "distance_miles": 179.0,
        "lat": 39.0997,
        "lon": -94.5786
      }
    ],
    "Lord Huron": [],
    "Royel Otis": [],
    "Massive Attack": [],
    "Radiohead": [],
    "The XX": [],
    "Alabama Shakes": [],
    "Tame Impala": [],
    "Zac Brown Band": [
      {
        "date": "Sep 10, 2026",
        "venue": "T-Mobile Center",
        "city": "Kansas City, MO",
        "status": "on_sale",
        "distance_miles": 179.0,
        "lat": 39.0997,
        "lon": -94.5786
      },
      {
        "date": "Nov 19, 2026",
        "venue": "Pinnacle Bank Arena",
        "city": "Lincoln, NE",
        "status": "on_sale",
        "distance_miles": 168.7,
        "lat": 40.8136,
        "lon": -96.7026
      },
      {
        "date": "Nov 20, 2026",
        "venue": "Casey's Center",
        "city": "Des Moines, IA",
        "status": "on_sale",
        "distance_miles": 0.0,
        "lat": 41.5868,
        "lon": -93.625
      }
    ]
  },
  "venue_shows": {
    "Hoyt Sherman Place": [
      {
        "date": "Feb 27, 2026",
        "artist": "Ballet Des Moines presents Nothing Holds Still",
        "tracked": false
      },
      {
        "date": "Feb 28, 2026",
        "artist": "Ballet Des Moines presents Nothing Holds Still",
        "tracked": false
      },
      {
        "date": "Mar 5, 2026",
        "artist": "Gaelic Storm",
        "tracked": false
      },
      {
        "date": "Mar 6, 2026",
        "artist": "Felipe Esparza: At My Leisure World Tour",
        "tracked": false
      },
      {
        "date": "Mar 7, 2026",
        "artist": "C.S. Lewis' The Screwtape Letters",
        "tracked": false
      },
      {
        "date": "Mar 9, 2026",
        "artist": "Steven Curtis Chapman",
        "tracked": false
      },
      {
        "date": "Mar 10, 2026",
        "artist": "Jeff Tweedy with special guest Sima Cunningham",
        "tracked": false
      },
      {
        "date": "Mar 11, 2026",
        "artist": "An Evening With TOTO",
        "tracked": false
      },
      {
        "date": "Mar 13, 2026",
        "artist": "Trisha Yearwood: The Mirror Tour",
        "tracked": false
      },
      {
        "date": "Mar 21, 2026",
        "artist": "Jessica Kirson",
        "tracked": false
      },
      {
        "date": "Mar 23, 2026",
        "artist": "Jim Breuer: Find the Funny",
        "tracked": false
      },
      {
        "date": "Mar 26, 2026",
        "artist": "Marty Stuart and His Fabulous Superlatives",
        "tracked": false
      },
      {
        "date": "Mar 27, 2026",
        "artist": "Jake Owen",
        "tracked": false
      },
      {
        "date": "Mar 28, 2026",
        "artist": "Whitney Cummings: Big Baby",
        "tracked": false
      },
      {
        "date": "Apr 2, 2026",
        "artist": "Carly Pearce",
        "tracked": false
      },
      {
        "date": "Apr 7, 2026",
        "artist": "Authors Visiting in Des Moines: Julia Quinn",
        "tracked": false
      },
      {
        "date": "Apr 9, 2026",
        "artist": "Henry Cho: The Empty Nest Tour",
        "tracked": false
      },
      {
        "date": "Apr 10, 2026",
        "artist": "Tim Hawkins Live",
        "tracked": false
      },
      {
        "date": "Apr 11, 2026",
        "artist": "Matt McCusker: Healing Frequency Tour",
        "tracked": false
      },
      {
        "date": "Apr 19, 2026",
        "artist": "Fortune Feimster: Takin' Care of Biscuits Comedy Tour",
        "tracked": false
      },
      {
        "date": "Apr 22, 2026",
        "artist": "The Psychology of Serial Killers",
        "tracked": false
      },
      {
        "date": "Apr 25, 2026",
        "artist": "KUD Dukat Presents Folklore Festival",
        "tracked": false
      },
      {
        "date": "Apr 28, 2026",
        "artist": "Devon Allman's Blues Summit",
        "tracked": false
      },
      {
        "date": "Apr 29, 2026",
        "artist": "Brigham Young University presents Vocal Point and Noteworthy",
        "tracked": false
      },
      {
        "date": "May 2, 2026",
        "artist": "Jimmy Failla: Everybody Calm Down Tour",
        "tracked": false
      },
      {
        "date": "May 3, 2026",
        "artist": "Kenny Wayne Shepherd Band",
        "tracked": false
      },
      {
        "date": "Jun 2, 2026",
        "artist": "Tell It Like It Is: Iowa Storytellers Project",
        "tracked": false
      },
      {
        "date": "Jun 14, 2026",
        "artist": "The Wallflowers",
        "tracked": false
      },
      {
        "date": "Jun 25, 2026",
        "artist": "The Robert Cray Band",
        "tracked": false
      },
      {
        "date": "Jun 28, 2026",
        "artist": "I'm With Her \u2013 Sing Me Alive Tour",
        "tracked": false
      },
      {
        "date": "Aug 21, 2026",
        "artist": "Maria Bamford",
        "tracked": false
      },
      {
        "date": "Sep 11, 2026",
        "artist": "Jefferson Starship Runaway Again Tour",
        "tracked": false
      },
      {
        "date": "Oct 7, 2026",
        "artist": "Jim Henson's Labyrinth: In Concert 40th Anniversary",
        "tracked": false
      },
      {
        "date": "Oct 9, 2026",
        "artist": "Leonid & Friends",
        "tracked": false
      },
      {
        "date": "Oct 13, 2026",
        "artist": "Snarky Puppy",
        "tracked": false
      },
      {
        "date": "Oct 16, 2026",
        "artist": "Big Head Todd and the Monsters",
        "tracked": false
      },
      {
        "date": "Nov 8, 2026",
        "artist": "Micky Dolenz \u2013 60 Years of the Monkees",